{"provenance":{"schema":"mnemoshare.deployment-contract.v2","generator":"internal/application/link/linkgen","source_fingerprint":"17acd064d4a2b3593a0da307956837480fe7d0514c2eba30a2d28cd28f8c87f1"},"fingerprint":"d75002a3137c7bc68b8e2a45ba6e8216cee6815553a8f793c37337922a150a34","processes":[{"id":"api","executable":"/usr/local/bin/mnemoshare-api","kind":"api","persistence":"selected","environment":["CUSTOMER_ID"],"probe":{"kind":"http","path":"/health","port":8080},"liveness_probe":{},"coexistence":"application-peers"},{"id":"background-worker","executable":"/usr/local/bin/background-worker","kind":"worker","persistence":"selected","engines":["background","kmsrotation","messaging"],"capabilities":["leader-sweep","system-ticker"],"environment":["CUSTOMER_ID"],"probe":{"kind":"process","command":["sh","-c","kill -0 1"]},"liveness_probe":{},"coexistence":"application-peers"},{"id":"cloud-worker","executable":"/usr/local/bin/cloud-worker","kind":"worker","persistence":"selected","engines":["google","messaging","microsoft"],"capabilities":["system-ticker"],"environment":["CUSTOMER_ID"],"probe":{"kind":"process","command":["sh","-c","kill -0 1"]},"liveness_probe":{},"coexistence":"application-peers"},{"id":"inboundgateway","executable":"/usr/local/bin/inbound-gateway","kind":"worker","persistence":"selected","environment":["CONTENT_FILTER_PORT","DELIVERY_WORKERS","ENCRYPTION_KEY","MONGODB_URI","PROCESSING_WORKERS","S3_ACCESS_KEY","S3_BUCKET","S3_ENDPOINT","S3_SECRET_KEY","SOCKETMAP_PORT"],"probe":{"kind":"http","path":"/healthz","port":8080},"liveness_probe":{},"coexistence":"application-peers"},{"id":"mcp-admin","executable":"/usr/local/bin/mcp-admin","args":["--transport=http","--http-addr=:9222","--log-level=info","--log-format=json"],"kind":"api","persistence":"none","environment":["MNEMOSHARE_MCP_KEY"],"probe":{"kind":"http","path":"/health","port":9222},"liveness_probe":{},"coexistence":"application-peers"},{"id":"sftp-gateway","executable":"/usr/local/bin/sftp-gateway","kind":"api","persistence":"none","environment":["SFTP_GATEWAY_API_BASE_URL","SFTP_GATEWAY_INTERNAL_API_SECRET","SFTP_GATEWAY_LICENSE_CAPABILITY_ENABLED"],"probe":{"kind":"http","path":"/readyz","port":8090},"liveness_probe":{"kind":"http","path":"/healthz","port":8090},"coexistence":"application-peers"},{"id":"workflow-worker","executable":"/usr/local/bin/workflow-worker","kind":"worker","persistence":"selected","engines":["messaging"],"environment":["CUSTOMER_ID"],"probe":{"kind":"process","command":["sh","-c","kill -0 1"]},"liveness_probe":{},"coexistence":"application-peers"}],"adapters":[{"executable":"/usr/local/bin/run-api-worker","processes":["api","background-worker","cloud-worker","workflow-worker"],"probe":{"kind":"http","path":"/health","port":8080},"image_default":true,"image_entrypoint":["/usr/local/bin/docker-entrypoint.sh"],"entrypoint_pass_through":true,"entrypoint_profile":"fips-pass-through"},{"executable":"/usr/local/bin/run-workers","processes":["background-worker","cloud-worker","workflow-worker"],"probe":{"kind":"process","command":["sh","-c","kill -0 1"]}}]}
